{
  "$schema": "http://json-schema.org/draft-07/schema#",
  "$id": "schema/economy.schema.json",
  "title": "Economy rules",
  "description": "Shape contract for shared/data/economy.json. Generated by tools/studio/gen-schemas.mjs — edit the generator, not this file.",
  "type": "object",
  "required": [
    "currencies",
    "dailyReward",
    "idle",
    "reward",
    "targets",
    "version",
    "xp"
  ],
  "additionalProperties": false,
  "properties": {
    "$schema": {
      "type": "string"
    },
    "_comment": {
      "type": "string"
    },
    "currencies": {
      "type": "object",
      "properties": {
        "coins": {
          "type": "object",
          "properties": {
            "cap": {
              "type": "integer"
            },
            "icon": {
              "type": "string"
            },
            "id": {
              "type": "string",
              "pattern": "^[a-z][a-z0-9_]*$"
            },
            "nameKey": {
              "type": "string"
            },
            "premium": {
              "type": "boolean"
            }
          },
          "required": [
            "cap",
            "icon",
            "id",
            "nameKey",
            "premium"
          ]
        },
        "embers": {
          "type": "object",
          "properties": {
            "cap": {
              "type": "integer"
            },
            "icon": {
              "type": "string"
            },
            "id": {
              "type": "string",
              "pattern": "^[a-z][a-z0-9_]*$"
            },
            "nameKey": {
              "type": "string"
            },
            "premium": {
              "type": "boolean"
            }
          },
          "required": [
            "cap",
            "icon",
            "id",
            "nameKey",
            "premium"
          ]
        }
      },
      "required": [
        "coins",
        "embers"
      ]
    },
    "dailyReward": {
      "type": "object",
      "properties": {
        "cycleDays": {
          "type": "integer"
        },
        "days": {
          "type": "array",
          "items": {
            "type": "object",
            "properties": {
              "day": {
                "type": "integer"
              },
              "rewards": {
                "type": "array",
                "items": {
                  "type": "object",
                  "properties": {
                    "amount": {
                      "type": "integer"
                    },
                    "currency": {
                      "enum": [
                        "coins",
                        "embers"
                      ]
                    },
                    "id": {
                      "type": "string",
                      "pattern": "^[a-z][a-z0-9_]*$"
                    },
                    "type": {
                      "type": "string"
                    }
                  }
                }
              }
            },
            "required": [
              "day",
              "rewards"
            ]
          }
        },
        "graceDays": {
          "type": "integer"
        },
        "streakBonusPerCycle": {
          "type": "number"
        }
      },
      "required": [
        "cycleDays",
        "days",
        "graceDays",
        "streakBonusPerCycle"
      ]
    },
    "idle": {
      "type": "object",
      "properties": {
        "adDoubleAvailable": {
          "type": "boolean"
        },
        "coinsPerMinuteByRestaurant": {
          "type": "array",
          "items": {
            "type": "integer"
          }
        },
        "maxOfflineHours": {
          "type": "integer"
        },
        "minCollectIntervalMin": {
          "type": "integer"
        },
        "rampInMinutes": {
          "type": "integer"
        },
        "unlockRestaurantIndex": {
          "type": "integer"
        },
        "xpPerMinuteByRestaurant": {
          "type": "array",
          "items": {
            "type": "number"
          }
        }
      },
      "required": [
        "adDoubleAvailable",
        "coinsPerMinuteByRestaurant",
        "maxOfflineHours",
        "minCollectIntervalMin",
        "rampInMinutes",
        "unlockRestaurantIndex",
        "xpPerMinuteByRestaurant"
      ]
    },
    "reward": {
      "type": "object",
      "properties": {
        "_curvesNote": {
          "type": "string"
        },
        "_note": {
          "type": "string"
        },
        "activeCoinMultiplierByRestaurant": {
          "type": "array",
          "items": {
            "type": [
              "integer",
              "number"
            ]
          }
        },
        "comboCap": {
          "type": "number"
        },
        "comboStep": {
          "type": "number"
        },
        "customerTipWeight": {
          "type": "number"
        },
        "levelUpCoins": {
          "type": "object",
          "properties": {
            "base": {
              "type": "integer"
            },
            "exponent": {
              "type": "number"
            },
            "type": {
              "type": "string"
            }
          },
          "required": [
            "base",
            "exponent",
            "type"
          ]
        },
        "levelUpEmbers": {
          "type": "object",
          "properties": {
            "amount": {
              "type": "integer"
            },
            "every": {
              "type": "integer"
            }
          },
          "required": [
            "amount",
            "every"
          ]
        },
        "orderBaseTip": {
          "type": "number"
        },
        "perfectTipBonus": {
          "type": "number"
        },
        "roundCoinMultiplierRange": {
          "type": "array",
          "items": {
            "type": "number"
          }
        },
        "speedBonusMax": {
          "type": "number"
        },
        "speedBonusWindow": {
          "type": "number"
        },
        "turnEndBonus": {
          "type": "object",
          "properties": {
            "base": {
              "type": "integer"
            },
            "perLostCustomer": {
              "type": "integer"
            },
            "perPerfect": {
              "type": "integer"
            }
          },
          "required": [
            "base",
            "perLostCustomer",
            "perPerfect"
          ]
        }
      },
      "required": [
        "_curvesNote",
        "_note",
        "activeCoinMultiplierByRestaurant",
        "comboCap",
        "comboStep",
        "customerTipWeight",
        "levelUpCoins",
        "levelUpEmbers",
        "orderBaseTip",
        "perfectTipBonus",
        "roundCoinMultiplierRange",
        "speedBonusMax",
        "speedBonusWindow",
        "turnEndBonus"
      ]
    },
    "targets": {
      "type": "object",
      "properties": {
        "_bandDerivationNote": {
          "type": "string"
        },
        "_comment": {
          "type": "string"
        },
        "_grillPacingNote": {
          "type": "string"
        },
        "_incomePlateauNote": {
          "type": "string"
        },
        "_pacingNote": {
          "type": "string"
        },
        "_spendRatioNote": {
          "type": "string"
        },
        "churrasqueiraUnlockPacingTurns": {
          "type": "object",
          "properties": {
            "fornalha_dragao_manso": {
              "type": "array",
              "items": {
                "type": "integer"
              }
            },
            "parrilla_chef_cisma": {
              "type": "array",
              "items": {
                "type": "integer"
              }
            },
            "ze_da_esquina": {
              "type": "array",
              "items": {
                "type": "integer"
              }
            }
          },
          "required": [
            "fornalha_dragao_manso",
            "parrilla_chef_cisma",
            "ze_da_esquina"
          ]
        },
        "coinSpendRatio": {
          "type": "array",
          "items": {
            "type": "number"
          }
        },
        "dailyCoinIncomeAtLevel": {
          "type": "object",
          "properties": {
            "5": {
              "type": "array",
              "items": {
                "type": "integer"
              }
            },
            "15": {
              "type": "array",
              "items": {
                "type": "integer"
              }
            },
            "30": {
              "type": "array",
              "items": {
                "type": "integer"
              }
            },
            "50": {
              "type": "array",
              "items": {
                "type": "integer"
              }
            }
          },
          "required": [
            "15",
            "30",
            "5",
            "50"
          ]
        },
        "firstUpgradeAffordableAfterTurns": {
          "type": "array",
          "items": {
            "type": "integer"
          }
        },
        "maxSingleTurnCoinSpikeVsMedian": {
          "type": "integer"
        },
        "noUpgradeCostRegression": {
          "type": "boolean"
        },
        "perfectRateAtSkillMid": {
          "type": "array",
          "items": {
            "type": "number"
          }
        },
        "restaurantUnlockPacingTurns": {
          "type": "object",
          "properties": {
            "churrascaria_bairro": {
              "type": "array",
              "items": {
                "type": "integer"
              }
            },
            "churrascaria_premium": {
              "type": "array",
              "items": {
                "type": "integer"
              }
            },
            "espetinho_rua": {
              "type": "array",
              "items": {
                "type": "integer"
              }
            },
            "festival": {
              "type": "array",
              "items": {
                "type": "integer"
              }
            },
            "rede_nacional": {
              "type": "array",
              "items": {
                "type": "integer"
              }
            },
            "trailer": {
              "type": "array",
              "items": {
                "type": "integer"
              }
            }
          },
          "required": [
            "churrascaria_bairro",
            "churrascaria_premium",
            "espetinho_rua",
            "festival",
            "rede_nacional",
            "trailer"
          ]
        },
        "sessionLengthMinutes": {
          "type": "array",
          "items": {
            "type": "integer"
          }
        },
        "turnsPerSession": {
          "type": "array",
          "items": {
            "type": "integer"
          }
        }
      },
      "required": [
        "_bandDerivationNote",
        "_comment",
        "_grillPacingNote",
        "_incomePlateauNote",
        "_pacingNote",
        "_spendRatioNote",
        "churrasqueiraUnlockPacingTurns",
        "coinSpendRatio",
        "dailyCoinIncomeAtLevel",
        "firstUpgradeAffordableAfterTurns",
        "maxSingleTurnCoinSpikeVsMedian",
        "noUpgradeCostRegression",
        "perfectRateAtSkillMid",
        "restaurantUnlockPacingTurns",
        "sessionLengthMinutes",
        "turnsPerSession"
      ]
    },
    "version": {
      "type": "integer"
    },
    "xp": {
      "type": "object",
      "properties": {
        "formula": {
          "type": "object",
          "properties": {
            "a": {
              "type": "integer"
            },
            "exponent": {
              "type": "number"
            },
            "minPerLevel": {
              "type": "integer"
            },
            "type": {
              "type": "string"
            }
          },
          "required": [
            "a",
            "exponent",
            "minPerLevel",
            "type"
          ]
        },
        "maxLevel": {
          "type": "integer"
        }
      },
      "required": [
        "formula",
        "maxLevel"
      ]
    }
  }
}
